<?xml version="1.0" ?>
<tstorms xmlns:xsi="http://www.w3.org/2001/XMLSchema-instance" version="1.0" xsi:schemaLocation="http://www.ral.ucar.edu/xml/schemas/ http://www.ral.ucar.edu/xml/schemas/tstorms.1.0.xsd">
<head>
    <system>TITAN</system>
    <title>TITAN Thunderstorm Tracks</title>
    <product-description>TITAN on SAWS Radar mosaic</product-description>
    <time-coordinate>UTC</time-coordinate>
    <write-time>2008-01-26T02:14:58</write-time>
</head>
<storm-data>
  <observation-time>2008-01-04T00:00:00</observation-time>
  <dbz-threshold>35</dbz-threshold>
  <storm ID="2">
    <instance relative-time="current">
      <time>2008-01-04T00:00:00</time>
      <location>
        <area>
          <ellipse>
            <moving-point type="centroid">
              <latitude>-26.3117</latitude>
              <longitude> 29.7217</longitude>
              <polar_motion>
                <speed units="km h-1">27.133</speed>
                <direction_to units="degrees true">70.0176</direction_to>
              </polar_motion>
            </moving-point>
            <major_axis units="km">0.034208</major_axis>
            <minor_axis units="km">0.0258476</minor_axis>
            <orientation units="degrees true">158.234</orientation>
          </ellipse>
          <polygon npoints="73">
            <moving-point type="centroid">
              <latitude>-26.3117</latitude>
              <longitude> 29.7217</longitude>
              <polar_motion>
                <speed units="km h-1">27.133</speed>
                <direction_to units="degrees true">70.0176</direction_to>
              </polar_motion>
            </moving-point>
            <point latitude="-26.2751" longitude="29.7217" />
            <point latitude="-26.2750" longitude="29.7249" />
            <point latitude="-26.2917" longitude="29.7252" />
            <point latitude="-26.2917" longitude="29.7270" />
            <point latitude="-26.2917" longitude="29.7289" />
            <point latitude="-26.2916" longitude="29.7310" />
            <point latitude="-26.2917" longitude="29.7332" />
            <point latitude="-26.2917" longitude="29.7356" />
            <point latitude="-26.2916" longitude="29.7385" />
            <point latitude="-26.2916" longitude="29.7417" />
            <point latitude="-26.2948" longitude="29.7417" />
            <point latitude="-26.2977" longitude="29.7416" />
            <point latitude="-26.3001" longitude="29.7416" />
            <point latitude="-26.3023" longitude="29.7417" />
            <point latitude="-26.3044" longitude="29.7416" />
            <point latitude="-26.3063" longitude="29.7416" />
            <point latitude="-26.3081" longitude="29.7417" />
            <point latitude="-26.3085" longitude="29.7583" />
            <point latitude="-26.3117" longitude="29.7583" />
            <point latitude="-26.3149" longitude="29.7583" />
            <point latitude="-26.3181" longitude="29.7582" />
            <point latitude="-26.3215" longitude="29.7583" />
            <point latitude="-26.3250" longitude="29.7583" />
            <point latitude="-26.3250" longitude="29.7502" />
            <point latitude="-26.3250" longitude="29.7448" />
            <point latitude="-26.3256" longitude="29.7416" />
            <point latitude="-26.3285" longitude="29.7417" />
            <point latitude="-26.3317" longitude="29.7417" />
            <point latitude="-26.3355" longitude="29.7417" />
            <point latitude="-26.3403" longitude="29.7417" />
            <point latitude="-26.3416" longitude="29.7390" />
            <point latitude="-26.3417" longitude="29.7357" />
            <point latitude="-26.3416" longitude="29.7326" />
            <point latitude="-26.3417" longitude="29.7297" />
            <point latitude="-26.3416" longitude="29.7269" />
            <point latitude="-26.3418" longitude="29.7243" />
            <point latitude="-26.3417" longitude="29.7217" />
            <point latitude="-26.3418" longitude="29.7190" />
            <point latitude="-26.3416" longitude="29.7164" />
            <point latitude="-26.3417" longitude="29.7136" />
            <point latitude="-26.3416" longitude="29.7108" />
            <point latitude="-26.3417" longitude="29.7077" />
            <point latitude="-26.3416" longitude="29.7044" />
            <point latitude="-26.3417" longitude="29.7007" />
            <point latitude="-26.3417" longitude="29.6965" />
            <point latitude="-26.3417" longitude="29.6916" />
            <point latitude="-26.3368" longitude="29.6917" />
            <point latitude="-26.3327" longitude="29.6917" />
            <point latitude="-26.3290" longitude="29.6917" />
            <point latitude="-26.3257" longitude="29.6916" />
            <point latitude="-26.3166" longitude="29.7082" />
            <point latitude="-26.3152" longitude="29.7084" />
            <point latitude="-26.3140" longitude="29.7083" />
            <point latitude="-26.3128" longitude="29.7084" />
            <point latitude="-26.3117" longitude="29.7083" />
            <point latitude="-26.3105" longitude="29.7084" />
            <point latitude="-26.3093" longitude="29.7083" />
            <point latitude="-26.3081" longitude="29.7084" />
            <point latitude="-26.3068" longitude="29.7082" />
            <point latitude="-26.3055" longitude="29.7084" />
            <point latitude="-26.3040" longitude="29.7083" />
            <point latitude="-26.2907" longitude="29.6917" />
            <point latitude="-26.2865" longitude="29.6917" />
            <point latitude="-26.2816" longitude="29.6916" />
            <point latitude="-26.2759" longitude="29.6917" />
            <point latitude="-26.2749" longitude="29.6959" />
            <point latitude="-26.2751" longitude="29.7005" />
            <point latitude="-26.2750" longitude="29.7046" />
            <point latitude="-26.2750" longitude="29.7083" />
            <point latitude="-26.2751" longitude="29.7119" />
            <point latitude="-26.2751" longitude="29.7152" />
            <point latitude="-26.2750" longitude="29.7185" />
            <point latitude="-26.2751" longitude="29.7217" />
          </polygon>
        </area>
      </location>
      <storm-parameters>
        <age units="seconds">4200</age>
        <cell_top units="km">6.5</cell_top>
        <max_dbz units="dbz">44.5</max_dbz>
      </storm-parameters>
    </instance>
    <instance relative-time="forecast">
      <time>2008-01-04T00:30:00</time>
      <location>
        <area>
          <ellipse>
            <moving-point type="centroid">
              <latitude>-26.2699</latitude>
              <longitude> 29.8495</longitude>
              <polar_motion>
                <speed units="km h-1">27.133</speed>
                <direction_to units="degrees true">70.0176</direction_to>
              </polar_motion>
            </moving-point>
            <major_axis units="km">0.034208</major_axis>
            <minor_axis units="km">0.0258476</minor_axis>
            <orientation units="degrees true">158.234</orientation>
          </ellipse>
          <polygon npoints="73">
            <moving-point type="centroid">
              <latitude>-26.2699</latitude>
              <longitude> 29.8495</longitude>
              <polar_motion>
                <speed units="km h-1">27.133</speed>
                <direction_to units="degrees true">70.0176</direction_to>
              </polar_motion>
            </moving-point>
            <point latitude="-26.2333" longitude="29.8495" />
            <point latitude="-26.2333" longitude="29.8527" />
            <point latitude="-26.2499" longitude="29.8531" />
            <point latitude="-26.2499" longitude="29.8549" />
            <point latitude="-26.2500" longitude="29.8568" />
            <point latitude="-26.2499" longitude="29.8589" />
            <point latitude="-26.2500" longitude="29.8611" />
            <point latitude="-26.2500" longitude="29.8635" />
            <point latitude="-26.2499" longitude="29.8663" />
            <point latitude="-26.2499" longitude="29.8696" />
            <point latitude="-26.2531" longitude="29.8696" />
            <point latitude="-26.2560" longitude="29.8695" />
            <point latitude="-26.2584" longitude="29.8695" />
            <point latitude="-26.2606" longitude="29.8696" />
            <point latitude="-26.2627" longitude="29.8695" />
            <point latitude="-26.2646" longitude="29.8695" />
            <point latitude="-26.2664" longitude="29.8695" />
            <point latitude="-26.2667" longitude="29.8862" />
            <point latitude="-26.2699" longitude="29.8861" />
            <point latitude="-26.2731" longitude="29.8862" />
            <point latitude="-26.2764" longitude="29.8861" />
            <point latitude="-26.2797" longitude="29.8861" />
            <point latitude="-26.2833" longitude="29.8862" />
            <point latitude="-26.2832" longitude="29.8781" />
            <point latitude="-26.2833" longitude="29.8727" />
            <point latitude="-26.2839" longitude="29.8695" />
            <point latitude="-26.2867" longitude="29.8696" />
            <point latitude="-26.2900" longitude="29.8696" />
            <point latitude="-26.2938" longitude="29.8695" />
            <point latitude="-26.2986" longitude="29.8696" />
            <point latitude="-26.2999" longitude="29.8668" />
            <point latitude="-26.2999" longitude="29.8635" />
            <point latitude="-26.2998" longitude="29.8604" />
            <point latitude="-26.3000" longitude="29.8576" />
            <point latitude="-26.2998" longitude="29.8548" />
            <point latitude="-26.3000" longitude="29.8522" />
            <point latitude="-26.2999" longitude="29.8495" />
            <point latitude="-26.3000" longitude="29.8469" />
            <point latitude="-26.2998" longitude="29.8442" />
            <point latitude="-26.3000" longitude="29.8415" />